[
 {
  "id": "script.acquire_assets",
  "kind": "script",
  "entry": "scripts/acquire_assets.py",
  "command": "python scripts/acquire_assets.py --help",
  "does": "Ingest explicitly supplied local media into the project with provenance and hashes.",
  "area": "pipeline",
  "status": "IMPLEMENTED",
  "tests": [],
  "curated": false
 },
 {
  "id": "script.align_audio",
  "kind": "script",
  "entry": "scripts/align_audio.py",
  "command": "python scripts/align_audio.py --help",
  "does": "Align narration with faster-whisper when installed; never fabricate timings.",
  "area": "sound",
  "status": "IMPLEMENTED",
  "tests": [],
  "curated": false
 },
 {
  "id": "script.align_captions",
  "kind": "script",
  "entry": "scripts/align_captions.py",
  "command": "python scripts/align_captions.py --help",
  "does": "Create captions from explicit timings; audio alignment adapters can be added later.",
  "area": "picture",
  "status": "IMPLEMENTED",
  "tests": [],
  "curated": false
 },
 {
  "id": "script.audio_mix",
  "kind": "script",
  "entry": "scripts/audio_mix.py",
  "command": "python scripts/audio_mix.py --help",
  "does": "Mix real narration and optional music with FFmpeg; no synthetic audio is created.",
  "area": "sound",
  "status": "IMPLEMENTED",
  "tests": [],
  "curated": false
 },
 {
  "id": "script.build_beat_map",
  "kind": "script",
  "entry": "scripts/build_beat_map.py",
  "command": "python scripts/build_beat_map.py --help",
  "does": "Build explicit narration alignment and beat timing from script records.",
  "area": "sound",
  "status": "IMPLEMENTED",
  "tests": [],
  "curated": false
 },
 {
  "id": "script.build_claims",
  "kind": "script",
  "entry": "scripts/build_claims.py",
  "command": "python scripts/build_claims.py --help",
  "does": "Create review-required claim records from ingested source excerpts.",
  "area": "knowledge",
  "status": "IMPLEMENTED",
  "tests": [],
  "curated": false
 },
 {
  "id": "script.build_editorial_slice",
  "kind": "script",
  "entry": "scripts/build_editorial_slice.py",
  "command": "python scripts/build_editorial_slice.py --help",
  "does": "Build the smallest real NarrativeOS editorial vertical slice from a JSON brief.",
  "area": "editing",
  "status": "IMPLEMENTED",
  "tests": [],
  "curated": false
 },
 {
  "id": "script.build_graphics",
  "kind": "script",
  "entry": "scripts/build_graphics.py",
  "command": "python scripts/build_graphics.py --help",
  "does": "Register explicit graphics/icon/thumbnail inputs; never invent source provenance.",
  "area": "picture",
  "status": "IMPLEMENTED",
  "tests": [],
  "curated": false
 },
 {
  "id": "script.build_provenance",
  "kind": "script",
  "entry": "scripts/build_provenance.py",
  "command": "python scripts/build_provenance.py --help",
  "does": "Collect hashes and lineage for project artifacts into a release manifest.",
  "area": "pipeline",
  "status": "TESTED",
  "tests": [
   "tests/test_channel_ops.py"
  ],
  "curated": false
 },
 {
  "id": "script.build_shotspec",
  "kind": "script",
  "entry": "scripts/build_shotspec.py",
  "command": "python scripts/build_shotspec.py --help",
  "does": "Build ShotSpecs from beat_map.json or script.json, never from timeline.json.",
  "area": "editing",
  "status": "TESTED",
  "tests": [
   "tests/test_controller.py"
  ],
  "curated": false
 },
 {
  "id": "script.build_timeline",
  "kind": "script",
  "entry": "scripts/build_timeline.py",
  "command": "python scripts/build_timeline.py --help",
  "does": "Assemble a canonical timeline from approved assets and ShotSpecs.",
  "area": "render",
  "status": "TESTED",
  "tests": [
   "tests/test_director_cli.py"
  ],
  "curated": false
 },
 {
  "id": "script.build_variants",
  "kind": "script",
  "entry": "scripts/build_variants.py",
  "command": "python scripts/build_variants.py --help",
  "does": "Create deterministic A/B timeline policy variants without claiming preference wins.",
  "area": "editing",
  "status": "IMPLEMENTED",
  "tests": [],
  "curated": false
 },
 {
  "id": "script.catalog",
  "kind": "script",
  "entry": "scripts/catalog.py",
  "command": "python scripts/catalog.py --help",
  "does": "The NarrativeOS catalog: what the system knows (studied references) and what it can do (capabilities), as JSON an app, a CLI or an agent can list. Every record follows a schema in schemas/.",
  "area": "knowledge",
  "status": "TESTED",
  "tests": [
   "tests/test_catalog.py"
  ],
  "curated": false
 },
 {
  "id": "script.channel",
  "kind": "script",
  "entry": "scripts/channel.py",
  "command": "python scripts/channel.py --help",
  "does": "Channel profiles: the persistent identity a channel's videos are made under.",
  "area": "publishing",
  "status": "TESTED",
  "tests": [
   "tests/test_channel_ops.py"
  ],
  "curated": false
 },
 {
  "id": "script.compile_timeline",
  "kind": "script",
  "entry": "scripts/compile_timeline.py",
  "command": "python scripts/compile_timeline.py --help",
  "does": "Multi-track timeline compiler: one validated timeline in, one FFmpeg render out. No stitching.",
  "area": "render",
  "status": "TESTED",
  "tests": [
   "tests/test_compile_timeline.py",
   "tests/test_final_cut.py",
   "tests/test_frame_awareness.py",
   "tests/test_signature.py",
   "tests/test_talking_head.py",
   "tests/test_typographic_lockup.py",
   "tests/test_voiceover_broll.py"
  ],
  "curated": false
 },
 {
  "id": "script.contact_sheet",
  "kind": "script",
  "entry": "scripts/contact_sheet.py",
  "command": "python scripts/contact_sheet.py --help",
  "does": "Contact sheet: tile rendered stills (t_<seconds>.jpg) or frames of a video into one labelled image, so a whole film can be looked at in one go. A template or a film is not done until its frames have been looked at (CLAUDE.md, evidence over assertion).",
  "area": "picture",
  "status": "IMPLEMENTED",
  "tests": [],
  "curated": false
 },
 {
  "id": "script.continuity_bible",
  "kind": "script",
  "entry": "scripts/continuity_bible.py",
  "command": "python scripts/continuity_bible.py --help",
  "does": "Create editable continuity records; unresolved facts remain review-required.",
  "area": "knowledge",
  "status": "TESTED",
  "tests": [
   "tests/test_controller.py"
  ],
  "curated": false
 },
 {
  "id": "script.controller",
  "kind": "script",
  "entry": "scripts/controller.py",
  "command": "python scripts/controller.py --help",
  "does": "Evidence-gated video workflow controller.",
  "area": "pipeline",
  "status": "TESTED",
  "tests": [
   "tests/test_channel_ops.py",
   "tests/test_controller.py",
   "tests/test_director_safety.py"
  ],
  "curated": false
 },
 {
  "id": "script.cost_router",
  "kind": "script",
  "entry": "scripts/cost_router.py",
  "command": "python scripts/cost_router.py --help",
  "does": "Record cost/quality routing decisions before expensive provider operations.",
  "area": "pipeline",
  "status": "IMPLEMENTED",
  "tests": [],
  "curated": false
 },
 {
  "id": "script.creative_memory",
  "kind": "script",
  "entry": "scripts/creative_memory.py",
  "command": "python scripts/creative_memory.py --help",
  "does": "Creative memory: what a human accepted, rejected or corrected, in context and with the reason.",
  "area": "knowledge",
  "status": "TESTED",
  "tests": [
   "tests/test_channel_ops.py"
  ],
  "curated": false
 },
 {
  "id": "script.delivery_review",
  "kind": "script",
  "entry": "scripts/delivery_review.py",
  "command": "python scripts/delivery_review.py --help",
  "does": "Create a release decision from real artifact presence and QA statuses.",
  "area": "publishing",
  "status": "IMPLEMENTED",
  "tests": [],
  "curated": false
 },
 {
  "id": "script.detect_contradictions",
  "kind": "script",
  "entry": "scripts/detect_contradictions.py",
  "command": "python scripts/detect_contradictions.py --help",
  "does": "Detect exact-key conflicts in supplied source claim records; no silent source selection.",
  "area": "knowledge",
  "status": "IMPLEMENTED",
  "tests": [],
  "curated": false
 },
 {
  "id": "script.director_brain",
  "kind": "script",
  "entry": "scripts/director_brain.py",
  "command": "python scripts/director_brain.py --help",
  "does": "Derive transparent editorial strategy artifacts from a brief and channel profile.",
  "area": "editing",
  "status": "TESTED",
  "tests": [
   "tests/test_controller.py",
   "tests/test_director_actions.py",
   "tests/test_director_safety.py",
   "tests/test_editing_intelligence.py",
   "tests/test_perception_rhythm.py"
  ],
  "curated": false
 },
 {
  "id": "script.director_pipeline",
  "kind": "script",
  "entry": "scripts/director_pipeline.py",
  "command": "python scripts/director_pipeline.py --help",
  "does": "Opt-in local measurements -> Director -> immutable review proposal bundle.",
  "area": "editing",
  "status": "TESTED",
  "tests": [
   "tests/test_director_cli.py",
   "tests/test_integration_flows.py"
  ],
  "curated": false
 },
 {
  "id": "script.earshot_bridge",
  "kind": "script",
  "entry": "scripts/earshot_bridge.py",
  "command": "python scripts/earshot_bridge.py --help",
  "does": "Bridge to Earshot (\"ears for coding agents\", MIT, https://github.com/Leonxlnx/earshot): NarrativeOS runs a batch of listening jobs in Earshot's own Python 3.12 environment, in ONE process, so the CLAP and AudioSet models load once (each CLI call loads them again, 20-40 s).",
  "status": "VALIDATED",
  "tests": [
   "tests/test_earshot_bridge.py"
  ],
  "curated": true,
  "area": "sound",
  "inputs": "a jobs JSON (describe, match, realness, timeline, critique, ...)",
  "outputs": "results JSON",
  "evidence": "3 tests on our own sounds and film, and the jimswormhole study (skills/narrativeos-sound-design/SKILL.md section 8).",
  "docs": null
 },
 {
  "id": "script.edit_patch",
  "kind": "module",
  "entry": "scripts/edit_patch.py",
  "command": null,
  "does": "Typed edit patches against the multi-track timeline (IR 3.0): the engine behind \"change this part\".",